{
  "groups": {
    "市政": "#d9a441",
    "灾害": "#ff5a2a",
    "天气": "#7fd6ff"
  },
  "shapes": {
    "市政": "penta",
    "灾害": "tri",
    "天气": "circle"
  },
  "types": {
    "节庆": {
      "g": "市政",
      "ch": "庆",
      "src": "镇公所",
      "rare": 1
    },
    "火灾": {
      "g": "灾害",
      "ch": "火",
      "src": "巡夜队",
      "rare": 2
    },
    "风暴": {
      "g": "天气",
      "ch": "风",
      "src": "港务所",
      "rare": 2
    }
  },
  "alias": {
    "集市日": "节庆",
    "起火": "火灾",
    "大风": "风暴",
    "festival": "节庆",
    "fire": "火灾",
    "storm": "风暴"
  },
  "closed": [
    "结束",
    "扑灭",
    "平息",
    "解除"
  ],
  "layers": [
    {
      "name": "山上",
      "map": "town_hill",
      "match": [
        "城堡",
        "堡垒",
        "广场",
        "旧堡",
        "钟塔",
        "钟楼",
        "集市",
        "集市广场"
      ]
    },
    {
      "name": "码头",
      "map": "town_harbour",
      "match": [
        "灯塔",
        "航标灯",
        "鱼市",
        "鱼市场"
      ]
    }
  ],
  "region": "雾港镇",
  "tag": "雾港镇事态"
}
